{"bundleKey":"TEN_K__4D__INTERMEDIATE","bundleVersion":1,"combination":{"documentType":"TEMPLATE_COMBINATION","key":"TEN_K__4D__INTERMEDIATE","version":1,"contentHash":"c6324371a352a78d744583ee6bd0d36bd434b9214ff46d5ecf107e2656876c71"},"masterTemplate":{"documentType":"PLAN_TEMPLATE","key":"TEN_K_MASTER","version":1,"contentHash":"c6cb0c0b4ebcfbdf946d97c9f03f1b8ec384abb68b8f0fa274a64a2eab9e5214"},"layout":{"documentType":"RUN_LAYOUT","key":"RUN_LAYOUT_4D","version":1,"contentHash":"ebcd2c80f852ea73c386aa9997389db2f12576c4e02605a29043641ae4d1327c"},"levelModifier":{"documentType":"LEVEL_MODIFIER","key":"INTERMEDIATE_MODIFIER","version":1,"contentHash":"c5e9d601f2756495c921676cb323872539eb65f901135b1240e27034861bff34"},"workoutProgression":{"documentType":"WORKOUT_PROGRESSION","key":"TEN_K_WORKOUT_PROGRESSION_V1","version":1,"contentHash":"a4856b47bf385ad29c148412480620b2584ddf7b0e0fa177664dc3455baf6281"},"progressionModifier":{"documentType":"PROGRESSION_MODIFIER","key":"INTERMEDIATE_PROGRESSION_MODIFIER_V1","version":1,"contentHash":"107fc930d057455a21da4ffcd94bc24feb2c02ac348edbab1e59dcc506f3a885"},"rulePack":{"documentType":"RULE_PACK","key":"APPSEL_RACE_PLAN_V1","version":1,"contentHash":"020f9aac902b7816d8d4b4f01a82b143df8d5feb23e8cc75f6d9fda36be66a89"},"runtimeConditionValueRegistry":{"documentType":"RUNTIME_CONDITION_VALUE_REGISTRY","key":"RUNTIME_CONDITION_VALUES_V1","version":1,"contentHash":"34bef999d0ec3dc30c004f99c1c83fea706c8bc6e882c9be8194e810d11d7fb2"},"peakVolumeBandPolicy":{"documentType":"PEAK_VOLUME_BAND_POLICY","key":"PEAK_VOLUME_BANDS_V1","version":1,"contentHash":"d187758e6f8034f44d7c4c5c8dfe4a2d176d66b2ff843bf0f2bc84ae758d7f6e"},"workouts":[{"documentType":"WORKOUT_DEFINITION","key":"EASY_STANDARD","version":1,"contentHash":"37990edcaf4f9253528bd41ae7428b4555f4c9fd95f3452930cf6db688086b80"},{"documentType":"WORKOUT_DEFINITION","key":"FARTLEK","version":1,"contentHash":"8652ed9aa01a0909ab1efffdacf1e029a164bd5784b505351b7296d6a5f89482"},{"documentType":"WORKOUT_DEFINITION","key":"GOAL_PACE_TEN_K","version":1,"contentHash":"15c857a834d1034d818be5e167b6d42e9a48aca422035949bd4d9257d6906679"},{"documentType":"WORKOUT_DEFINITION","key":"THRESHOLD_TEMPO","version":1,"contentHash":"3da4f9606f91e91323e0cf5aeb6763bbad6149319f037f32d44581f5a5522621"}],"bundleContentHash":"ed997d55831437bcbce8c345bb2074e4c9ff6ba2ad7f62e048a65d8c37dee734"}