{"bundleKey":"TEN_K__4D__ADVANCED","bundleVersion":1,"combination":{"documentType":"TEMPLATE_COMBINATION","key":"TEN_K__4D__ADVANCED","version":1,"contentHash":"3aea75ccc5dfe0523102eeb7d2ce6bf06585ccd80d149e22a411fd6216b88d9c"},"masterTemplate":{"documentType":"PLAN_TEMPLATE","key":"TEN_K_MASTER","version":6,"contentHash":"3c8c21c9c927f1fb581b5effc5ff9c13681ae897caafe679fd82feffe80991cd"},"layout":{"documentType":"RUN_LAYOUT","key":"RUN_LAYOUT_4D","version":1,"contentHash":"ebcd2c80f852ea73c386aa9997389db2f12576c4e02605a29043641ae4d1327c"},"levelModifier":{"documentType":"LEVEL_MODIFIER","key":"ADVANCED_MODIFIER","version":1,"contentHash":"9befb70a8b010aa7976039f2fc9dc7bade52d9231fd5752a466ccfe0fcd4c121"},"workoutProgression":{"documentType":"WORKOUT_PROGRESSION","key":"TEN_K_WORKOUT_PROGRESSION_V1","version":5,"contentHash":"85adbb5b5f9ff1031f3d06007835bb04b624b11b4c9407e2db4bc75f1a9721bd"},"progressionModifier":{"documentType":"PROGRESSION_MODIFIER","key":"ADVANCED_PROGRESSION_MODIFIER_V1","version":1,"contentHash":"37a223234bbc884578f621ad40c5e2b39e962d7f6a8c60024da89fa237cd10dc"},"rulePack":{"documentType":"RULE_PACK","key":"APPSEL_RACE_PLAN_V1","version":7,"contentHash":"a321d905e3a28e6c9a6ebbae09a606ed506a5ae515fe7342bcdc041892ff4803"},"runtimeConditionValueRegistry":{"documentType":"RUNTIME_CONDITION_VALUE_REGISTRY","key":"RUNTIME_CONDITION_VALUES_V1","version":2,"contentHash":"77de336854d9bb367ed3b575b52c881467f5266041d746ce1b91f708ea3cbd7c"},"peakVolumeBandPolicy":{"documentType":"PEAK_VOLUME_BAND_POLICY","key":"PEAK_VOLUME_BANDS_V1","version":6,"contentHash":"5857e8359f63640b26f94570bfa4082450a0370310a4c430dd4d35f57a247ff8"},"workouts":[{"documentType":"WORKOUT_DEFINITION","key":"EASY_STANDARD","version":4,"contentHash":"19319e30efc4926df70adee30343f7acfbc5c7121d199f0581e56316aff384c6"},{"documentType":"WORKOUT_DEFINITION","key":"FARTLEK","version":4,"contentHash":"8e80368354f83b899e892c670fdcec4a80125630150c87c9f5a631bb8f4e7dac"},{"documentType":"WORKOUT_DEFINITION","key":"GOAL_PACE_TEN_K","version":2,"contentHash":"722da8ef8b5da48cde7cb6817ee645686a60dd29015c5b88de2c8b1a87046726"},{"documentType":"WORKOUT_DEFINITION","key":"LONG_RUN_STANDARD","version":4,"contentHash":"e46eda5e5e7cfa8a4243d2c703b78a279586cd34dbf01ce3bc241f485cf03635"},{"documentType":"WORKOUT_DEFINITION","key":"THRESHOLD_TEMPO","version":4,"contentHash":"841f0584e83d31433eabb03acc9be494dab98b2735d31e23c7168300dea948c7"}],"bundleContentHash":"5704bb80827a974f59efc6383e087cd1a7205117df305530fdb81c9256a0c10c"}