{"bundleKey":"TEN_K__4D__INTERMEDIATE","bundleVersion":1,"combination":{"documentType":"TEMPLATE_COMBINATION","key":"TEN_K__4D__INTERMEDIATE","version":1,"contentHash":"e976d10e4015981fdcdc925312502d12b92e36cc8da73d89775b672f03d0ab57"},"masterTemplate":{"documentType":"PLAN_TEMPLATE","key":"TEN_K_MASTER","version":2,"contentHash":"9ac7f07666a26ec95080592534cf92e5892d6f0853566cc0ffb4d28e527be4b0"},"layout":{"documentType":"RUN_LAYOUT","key":"RUN_LAYOUT_4D","version":1,"contentHash":"ebcd2c80f852ea73c386aa9997389db2f12576c4e02605a29043641ae4d1327c"},"levelModifier":{"documentType":"LEVEL_MODIFIER","key":"INTERMEDIATE_MODIFIER","version":1,"contentHash":"c5e9d601f2756495c921676cb323872539eb65f901135b1240e27034861bff34"},"workoutProgression":{"documentType":"WORKOUT_PROGRESSION","key":"TEN_K_WORKOUT_PROGRESSION_V1","version":1,"contentHash":"a4856b47bf385ad29c148412480620b2584ddf7b0e0fa177664dc3455baf6281"},"progressionModifier":{"documentType":"PROGRESSION_MODIFIER","key":"INTERMEDIATE_PROGRESSION_MODIFIER_V1","version":1,"contentHash":"107fc930d057455a21da4ffcd94bc24feb2c02ac348edbab1e59dcc506f3a885"},"rulePack":{"documentType":"RULE_PACK","key":"APPSEL_RACE_PLAN_V1","version":1,"contentHash":"020f9aac902b7816d8d4b4f01a82b143df8d5feb23e8cc75f6d9fda36be66a89"},"runtimeConditionValueRegistry":{"documentType":"RUNTIME_CONDITION_VALUE_REGISTRY","key":"RUNTIME_CONDITION_VALUES_V1","version":1,"contentHash":"34bef999d0ec3dc30c004f99c1c83fea706c8bc6e882c9be8194e810d11d7fb2"},"peakVolumeBandPolicy":{"documentType":"PEAK_VOLUME_BAND_POLICY","key":"PEAK_VOLUME_BANDS_V1","version":1,"contentHash":"d187758e6f8034f44d7c4c5c8dfe4a2d176d66b2ff843bf0f2bc84ae758d7f6e"},"workouts":[{"documentType":"WORKOUT_DEFINITION","key":"EASY_STANDARD","version":1,"contentHash":"8ddedec6ac61b25c1febdb6b1b839a045eb685a8c7a90558abea0c3d2029a3d1"},{"documentType":"WORKOUT_DEFINITION","key":"FARTLEK","version":1,"contentHash":"c6a27cc2ebc53fdffd397054e6aa50df06f865ed1b558c0ddd1a944a653c7795"},{"documentType":"WORKOUT_DEFINITION","key":"GOAL_PACE_TEN_K","version":1,"contentHash":"15c857a834d1034d818be5e167b6d42e9a48aca422035949bd4d9257d6906679"},{"documentType":"WORKOUT_DEFINITION","key":"THRESHOLD_TEMPO","version":1,"contentHash":"48504242ac8fbf94bce10acf3628bdcadcf72cb548b0e1dfc10ebe61c189bb1d"}],"bundleContentHash":"6974e592f34807b10f75f8fccb8cc5568003b6c81074f9ee8030d7a414c0967d"}