{"bundleKey":"TEN_K__2D__BEGINNER","bundleVersion":1,"combination":{"documentType":"TEMPLATE_COMBINATION","key":"TEN_K__2D__BEGINNER","version":1,"contentHash":"3374a10de44f38d357b4b4c03541622178a7a50791ce0b2d26abf177982811d2"},"masterTemplate":{"documentType":"PLAN_TEMPLATE","key":"TEN_K_MASTER","version":11,"contentHash":"6d242970ef15d3900b686c204f1b002efd19f54e656d81ba3f3d5184a597ee0c"},"layout":{"documentType":"RUN_LAYOUT","key":"RUN_LAYOUT_2D","version":1,"contentHash":"e778b4b7392a417deac3f92433613e47f7f0a75532078b780c431ee6bf1101f0"},"levelModifier":{"documentType":"LEVEL_MODIFIER","key":"BEGINNER_MODIFIER","version":1,"contentHash":"bd6dcb5fa8f3db103fb90599654f71e12e3b69e0309572216195d7c680316db4"},"workoutProgression":{"documentType":"WORKOUT_PROGRESSION","key":"TEN_K_WORKOUT_PROGRESSION_2D_V1","version":1,"contentHash":"ba1cf8b4706a6a398a8b9e412b3bd5ce90419e27794a523c4ae8d83907706caa"},"progressionModifier":{"documentType":"PROGRESSION_MODIFIER","key":"BEGINNER_PROGRESSION_MODIFIER_V1","version":1,"contentHash":"194a0227f6af3e0dbb8f1af2cef71879b9cbaa2d17c3f2552549e351d5a09778"},"rulePack":{"documentType":"RULE_PACK","key":"APPSEL_RACE_PLAN_V1","version":8,"contentHash":"d02a5026c4026e4e46611dceebb2f9d4e021d7f8c8a4647b0d1c7204413e0fa4"},"runtimeConditionValueRegistry":{"documentType":"RUNTIME_CONDITION_VALUE_REGISTRY","key":"RUNTIME_CONDITION_VALUES_V1","version":2,"contentHash":"77de336854d9bb367ed3b575b52c881467f5266041d746ce1b91f708ea3cbd7c"},"peakVolumeBandPolicy":{"documentType":"PEAK_VOLUME_BAND_POLICY","key":"PEAK_VOLUME_BANDS_V1","version":7,"contentHash":"c94825d05edfeff3839899945c6fe36b158551cc7415f9ba797c2b509792708b"},"workouts":[{"documentType":"WORKOUT_DEFINITION","key":"EASY_STANDARD","version":4,"contentHash":"19319e30efc4926df70adee30343f7acfbc5c7121d199f0581e56316aff384c6"},{"documentType":"WORKOUT_DEFINITION","key":"FARTLEK","version":4,"contentHash":"8e80368354f83b899e892c670fdcec4a80125630150c87c9f5a631bb8f4e7dac"},{"documentType":"WORKOUT_DEFINITION","key":"GOAL_PACE_TEN_K","version":2,"contentHash":"722da8ef8b5da48cde7cb6817ee645686a60dd29015c5b88de2c8b1a87046726"},{"documentType":"WORKOUT_DEFINITION","key":"LONG_RUN_STANDARD","version":4,"contentHash":"e46eda5e5e7cfa8a4243d2c703b78a279586cd34dbf01ce3bc241f485cf03635"},{"documentType":"WORKOUT_DEFINITION","key":"THRESHOLD_TEMPO","version":4,"contentHash":"841f0584e83d31433eabb03acc9be494dab98b2735d31e23c7168300dea948c7"}],"bundleContentHash":"3c81adff339da0ff65b6a63db8103b6c063e680ce2e073d79f2d9b389972cf0f"}