{"bundleKey":"TEN_K__4D__BEGINNER","bundleVersion":1,"combination":{"documentType":"TEMPLATE_COMBINATION","key":"TEN_K__4D__BEGINNER","version":1,"contentHash":"1e5c670610494bf50815cae46fb3e1ebae01a03f69de2c86f28d32260a75bd53"},"masterTemplate":{"documentType":"PLAN_TEMPLATE","key":"TEN_K_MASTER","version":6,"contentHash":"3c8c21c9c927f1fb581b5effc5ff9c13681ae897caafe679fd82feffe80991cd"},"layout":{"documentType":"RUN_LAYOUT","key":"RUN_LAYOUT_4D","version":1,"contentHash":"ebcd2c80f852ea73c386aa9997389db2f12576c4e02605a29043641ae4d1327c"},"levelModifier":{"documentType":"LEVEL_MODIFIER","key":"BEGINNER_MODIFIER","version":1,"contentHash":"bd6dcb5fa8f3db103fb90599654f71e12e3b69e0309572216195d7c680316db4"},"workoutProgression":{"documentType":"WORKOUT_PROGRESSION","key":"TEN_K_WORKOUT_PROGRESSION_V1","version":5,"contentHash":"85adbb5b5f9ff1031f3d06007835bb04b624b11b4c9407e2db4bc75f1a9721bd"},"progressionModifier":{"documentType":"PROGRESSION_MODIFIER","key":"BEGINNER_PROGRESSION_MODIFIER_V1","version":1,"contentHash":"194a0227f6af3e0dbb8f1af2cef71879b9cbaa2d17c3f2552549e351d5a09778"},"rulePack":{"documentType":"RULE_PACK","key":"APPSEL_RACE_PLAN_V1","version":5,"contentHash":"b16c19fe5a6941fc01e3d0c74e627617ee8976109dffb6c049e70e5a509226b6"},"runtimeConditionValueRegistry":{"documentType":"RUNTIME_CONDITION_VALUE_REGISTRY","key":"RUNTIME_CONDITION_VALUES_V1","version":2,"contentHash":"77de336854d9bb367ed3b575b52c881467f5266041d746ce1b91f708ea3cbd7c"},"peakVolumeBandPolicy":{"documentType":"PEAK_VOLUME_BAND_POLICY","key":"PEAK_VOLUME_BANDS_V1","version":4,"contentHash":"e2386218a496b6532b3b4cba4892a8b808e49cf606157d0a68c2c9055564401e"},"workouts":[{"documentType":"WORKOUT_DEFINITION","key":"EASY_STANDARD","version":4,"contentHash":"19319e30efc4926df70adee30343f7acfbc5c7121d199f0581e56316aff384c6"},{"documentType":"WORKOUT_DEFINITION","key":"FARTLEK","version":4,"contentHash":"8e80368354f83b899e892c670fdcec4a80125630150c87c9f5a631bb8f4e7dac"},{"documentType":"WORKOUT_DEFINITION","key":"GOAL_PACE_TEN_K","version":2,"contentHash":"722da8ef8b5da48cde7cb6817ee645686a60dd29015c5b88de2c8b1a87046726"},{"documentType":"WORKOUT_DEFINITION","key":"LONG_RUN_STANDARD","version":4,"contentHash":"e46eda5e5e7cfa8a4243d2c703b78a279586cd34dbf01ce3bc241f485cf03635"},{"documentType":"WORKOUT_DEFINITION","key":"THRESHOLD_TEMPO","version":4,"contentHash":"841f0584e83d31433eabb03acc9be494dab98b2735d31e23c7168300dea948c7"}],"bundleContentHash":"e25c6a88c5f60c31355c59c2ad7bfcb631e3e190d8d588514e3acad85ffc0a16"}