{"bundleKey":"TEN_K__4D__INTERMEDIATE","bundleVersion":4,"combination":{"documentType":"TEMPLATE_COMBINATION","key":"TEN_K__4D__INTERMEDIATE","version":4,"contentHash":"5c6c701b783ee04794a3d2b19aa0d6b640ea3263f89d415bff396d01a6f3daac"},"masterTemplate":{"documentType":"PLAN_TEMPLATE","key":"TEN_K_MASTER","version":3,"contentHash":"e2ede6a030b3ea1a09b798c2c21840702375bffc2e489bc58f31d51f407e66bb"},"layout":{"documentType":"RUN_LAYOUT","key":"RUN_LAYOUT_4D","version":1,"contentHash":"ebcd2c80f852ea73c386aa9997389db2f12576c4e02605a29043641ae4d1327c"},"levelModifier":{"documentType":"LEVEL_MODIFIER","key":"INTERMEDIATE_MODIFIER","version":2,"contentHash":"1dda5d17b444710581afda274fae41534d8c619056235453455a76a3ed152770"},"workoutProgression":{"documentType":"WORKOUT_PROGRESSION","key":"TEN_K_WORKOUT_PROGRESSION_V1","version":2,"contentHash":"a7bf02812e9931322be7625f3e26a8d3217100a9c7d7df190adedd4dd48f23f4"},"progressionModifier":{"documentType":"PROGRESSION_MODIFIER","key":"INTERMEDIATE_PROGRESSION_MODIFIER_V1","version":1,"contentHash":"107fc930d057455a21da4ffcd94bc24feb2c02ac348edbab1e59dcc506f3a885"},"rulePack":{"documentType":"RULE_PACK","key":"APPSEL_RACE_PLAN_V1","version":2,"contentHash":"4ea4270573074714993942feb25b25d93aa00aec6ba4c7ad8896aadb91670300"},"runtimeConditionValueRegistry":{"documentType":"RUNTIME_CONDITION_VALUE_REGISTRY","key":"RUNTIME_CONDITION_VALUES_V1","version":1,"contentHash":"34bef999d0ec3dc30c004f99c1c83fea706c8bc6e882c9be8194e810d11d7fb2"},"peakVolumeBandPolicy":{"documentType":"PEAK_VOLUME_BAND_POLICY","key":"PEAK_VOLUME_BANDS_V1","version":2,"contentHash":"c2ad31a51d9390087ef4a2fc1f92d9e0b3a1f80183a93dc0921b0066030d6eb2"},"workouts":[{"documentType":"WORKOUT_DEFINITION","key":"EASY_STANDARD","version":2,"contentHash":"166aa9d97968a5da94b12c00b301f8e23cd4730df5a093b6c977b43160ae0dbf"},{"documentType":"WORKOUT_DEFINITION","key":"FARTLEK","version":2,"contentHash":"6df78c0fd292791f0fd8ff149f6aba2d8765e0b1fbc6d9867d6832c0009f7c27"},{"documentType":"WORKOUT_DEFINITION","key":"GOAL_PACE_TEN_K","version":1,"contentHash":"15c857a834d1034d818be5e167b6d42e9a48aca422035949bd4d9257d6906679"},{"documentType":"WORKOUT_DEFINITION","key":"LONG_RUN_STANDARD","version":2,"contentHash":"4d6d0ef3683dedf85cf2f2fcdc09ca9129def078e8fac959136f569b17ba5d6f"},{"documentType":"WORKOUT_DEFINITION","key":"THRESHOLD_TEMPO","version":2,"contentHash":"32032852e32340672c036e3d442fa91e5d8b0b1ca7af475362a54addb065b8f3"}],"bundleContentHash":"0a574a7abcefaed04b54844ba06d6ae047286f43562b7c540e3a30ad695f401b"}